{
 "name": "roundtrip-heredoc-turns",
 "kind": "roundtrip",
 "vocab": [
  "std"
 ],
 "entry": {
  "name": "tools_v1",
  "versions": {
   "kernel": "0.8.0",
   "vocab": {
    "transport/heredoc_tools": "0.1.0",
    "format/code_arguments": "0.1.0",
    "format/function_tool": "0.1.0",
    "format/code_calls": "0.1.0"
   }
  },
  "template": [
   {
    "role": "system",
    "text": "{instruction}\n{% for f in outputs %}<{f.name}>\n{f.value}\n</{f.name}>\n{% endfor %}"
   },
   {
    "directive": "turns"
   },
   {
    "role": "user",
    "text": "{question}"
   }
  ],
  "reader": {
   "kind": "derived"
  },
  "transports": {
   "tools": {
    "use": "heredoc_tools"
   }
  },
  "formats": {
   "list[Tool]": {
    "use": "function_tool"
   },
   "list[ToolCall]": {
    "use": "code_calls"
   }
  }
 },
 "expect": {
  "entry": {
   "name": "tools_v1",
   "versions": {
    "kernel": "0.8.6",
    "vocab": {
     "transport/heredoc_tools": "0.1.0",
     "format/code_arguments": "0.1.0",
     "format/function_tool": "0.1.0",
     "format/code_calls": "0.1.0"
    }
   },
   "template": [
    {
     "role": "system",
     "text": "{instruction}\n{% for f in outputs %}<{f.name}>\n{f.value}\n</{f.name}>\n{% endfor %}"
    },
    {
     "directive": "turns"
    },
    {
     "role": "user",
     "text": "{question}"
    }
   ],
   "reader": {
    "kind": "derived"
   },
   "transports": {
    "tools": {
     "use": "heredoc_tools"
    }
   },
   "formats": {
    "list[Tool]": {
     "use": "function_tool"
    },
    "list[ToolCall]": {
     "use": "code_calls"
    }
   }
  }
 }
}
