{
 "name": "render-shipped-udf",
 "kind": "render",
 "requires": [
  "udf:python"
 ],
 "entry": {
  "name": "udf_v1",
  "versions": {
   "kernel": "0.7.0",
   "vocab": {}
  },
  "template": [
   {
    "role": "system",
    "text": "{instruction}\n\nAnswer in exactly this form:\n{% for f in outputs %}<{f.name}>\n{f.value}\n</{f.name}>\n{% endfor %}"
   },
   {
    "directive": "turns"
   },
   {
    "role": "user",
    "text": "{q}"
   }
  ],
  "reader": {
   "kind": "derived"
  },
  "formats": {
   "Person": {
    "language": "python",
    "deps": [],
    "write": "def write(p, f):\n    return p['name'] + ' (' + str(p['age']) + ')'",
    "read": "def read(span, f):\n    name, _, rest = span.text.rpartition(' (')\n    return {'name': name, 'age': int(rest[:-1])}",
    "describe": "def describe(f):\n    return 'name (age)'",
    "sha256": "b56b17c3e2afbedf3bb9d8de82a49ded449f7d382e79f0f6e74d982341c68883",
    "authored_by": "corpus",
    "accepts": [
     "Person"
    ],
    "writes": "text",
    "round_trip": true,
    "reads": [
     "text"
    ]
   }
  }
 },
 "signature": {
  "instructions": "Extract.",
  "fields": [
   {
    "name": "q",
    "direction": "input",
    "shape": {
     "type": "string"
    }
   },
   {
    "name": "who",
    "direction": "output",
    "shape": {
     "type": "object"
    },
    "type": "Person"
   }
  ]
 },
 "inputs": {
  "q": "go"
 },
 "turns": {
  "turns": [
   {
    "inputs": {
     "q": "went"
    },
    "outputs": {
     "who": {
      "name": "Ann",
      "age": 41
     }
    }
   }
  ]
 },
 "expect": {
  "request": {
   "system": "Extract.\n\nAnswer in exactly this form:\n<who>\nname (age)\n</who>\n",
   "messages": [
    {
     "role": "user",
     "parts": [
      {
       "type": "text",
       "text": "went"
      }
     ]
    },
    {
     "role": "assistant",
     "parts": [
      {
       "type": "text",
       "text": "<who>\nAnn (41)\n</who>"
      }
     ]
    },
    {
     "role": "user",
     "parts": [
      {
       "type": "text",
       "text": "go"
      }
     ]
    }
   ]
  }
 }
}
