{
 "name": "refuse-json-lens-needs-capability",
 "kind": "refuse",
 "vocab": [
  "std"
 ],
 "entry": {
  "name": "json_lens_v1",
  "versions": {
   "kernel": "0.6.0",
   "vocab": {
    "lens/json_object": "0.1.0"
   }
  },
  "template": [
   {
    "role": "user",
    "text": "{question}"
   }
  ],
  "parse": {
   "kind": "json_object"
  }
 },
 "signature": {
  "instructions": "Answer.",
  "fields": [
   {
    "name": "question",
    "direction": "input",
    "shape": {
     "type": "string"
    }
   },
   {
    "name": "answer",
    "direction": "output",
    "shape": {
     "type": "string"
    }
   }
  ]
 },
 "expect": {
  "code": "capability-missing",
  "fix": {
   "action": "declare-capability",
   "fact": "native_structured_output"
  },
  "at": "bind"
 }
}
