{
 "name": "std-json-format",
 "kind": "parse",
 "vocab": [
  "std"
 ],
 "entry": {
  "name": "sections_v1",
  "versions": {
   "kernel": "0.6.0",
   "vocab": {
    "format/json": "0.1.0"
   }
  },
  "template": [
   {
    "role": "system",
    "text": "{instruction}\n\nReply with EXACTLY these sections:\n{% for f in outputs %}<{f.name}>\n{f.value}\n{% endfor %}</done>"
   },
   {
    "directive": "demos"
   },
   {
    "directive": "history"
   },
   {
    "role": "user",
    "text": "{% for f in inputs %}== {f.name} ==\n{f.value}\n{% endfor %}"
   }
  ],
  "parse": {
   "kind": "derived"
  },
  "formats": {
   "list[string]": {
    "use": "json"
   }
  }
 },
 "signature": {
  "instructions": "Extract.",
  "fields": [
   {
    "name": "q",
    "direction": "input",
    "shape": {
     "type": "string"
    }
   },
   {
    "name": "items",
    "direction": "output",
    "shape": {
     "type": "array",
     "items": {
      "type": "string"
     }
    }
   }
  ]
 },
 "response": "<items>\n```json\n[\"a\", \"b\"]\n```\n</done>",
 "expect": {
  "values": {
   "items": [
    "a",
    "b"
   ]
  }
 }
}
