{
 "name": "parse-media-list",
 "kind": "parse",
 "entry": {
  "name": "parts_v1",
  "versions": {
   "kernel": "0.8.7",
   "vocab": {}
  },
  "template": [
   {
    "role": "system",
    "text": "{instruction}\n{% for f in outputs %}<{f.name}>\n{f.value}\n</{f.name}>\n{% endfor %}"
   },
   {
    "directive": "turns"
   },
   {
    "role": "user",
    "text": "{q}"
   }
  ],
  "reader": {
   "kind": "derived"
  }
 },
 "signature": {
  "instructions": "Illustrate.",
  "fields": [
   {
    "name": "q",
    "direction": "input",
    "shape": {
     "type": "string"
    }
   },
   {
    "name": "caption",
    "direction": "output",
    "shape": {
     "type": "string"
    }
   },
   {
    "name": "pictures",
    "direction": "output",
    "shape": {
     "type": "array",
     "items": {
      "media": "image"
     }
    }
   }
  ]
 },
 "response": {
  "role": "assistant",
  "parts": [
   {
    "type": "image",
    "media_type": "image/png",
    "url": "https://example.com/stray.png"
   },
   {
    "type": "text",
    "text": "<caption>\nTwo cats\n</caption>\n<pictures>\n"
   },
   {
    "type": "image",
    "media_type": "image/png",
    "url": "https://example.com/1.png"
   },
   {
    "type": "text",
    "text": "\nand\n"
   },
   {
    "type": "audio",
    "media_type": "audio/wav",
    "data": "UklG"
   },
   {
    "type": "image",
    "media_type": "image/png",
    "url": "https://example.com/2.png"
   },
   {
    "type": "text",
    "text": "\n</pictures>"
   }
  ]
 },
 "expect": {
  "values": {
   "caption": "Two cats",
   "pictures": [
    {
     "media_type": "image/png",
     "url": "https://example.com/1.png"
    },
    {
     "media_type": "image/png",
     "url": "https://example.com/2.png"
    }
   ]
  },
  "repairs": [
   {
    "repair": "ignored",
    "part": "image"
   }
  ]
 }
}
