{
 "name": "refuse-load-find-from-trailing-newline",
 "kind": "refuse",
 "entry": {
  "name": "derived_v1",
  "versions": {
   "kernel": "0.8.0",
   "vocab": {}
  },
  "template": [
   {
    "role": "system",
    "text": "{instruction}\n\nAnswer in exactly this form:\n{% for f in outputs %}<{f.name}>\n{f.value}\n</{f.name}>\n{% endfor %}"
   },
   {
    "role": "user",
    "text": "{q}"
   }
  ],
  "reader": {
   "kind": "derived"
  },
  "transports": {
   "reasoning": {
    "in_template": false,
    "find": [
     {
      "from": "part:thinking\n",
      "to": "@purpose"
     }
    ]
   }
  }
 },
 "signature": {
  "instructions": "Answer.",
  "fields": [
   {
    "name": "q",
    "direction": "input",
    "shape": {
     "type": "string"
    }
   },
   {
    "name": "reasoning",
    "direction": "output",
    "shape": {
     "type": "string"
    },
    "purpose": "reasoning"
   },
   {
    "name": "answer",
    "direction": "output",
    "shape": {
     "type": "string"
    }
   }
  ]
 },
 "expect": {
  "code": "entry-malformed",
  "fix": {
   "action": "edit-entry",
   "path": "transports['reasoning'].find[0]"
  },
  "at": "load"
 }
}
