{
 "name": "refuse-load-regex-dialect",
 "kind": "refuse",
 "requires": [
  "pattern/legacy-re2"
 ],
 "entry": {
  "name": "derived_v1",
  "versions": {
   "kernel": "0.6.0",
   "vocab": {}
  },
  "extensions": {
   "pattern/legacy-re2": "0.1.0"
  },
  "template": [
   {
    "role": "system",
    "text": "{instruction}\n\nAnswer in exactly this form:\n{% for f in outputs %}<{f.name}>\n{f.value}\n</{f.name}>\n{% endfor %}"
   },
   {
    "role": "user",
    "text": "{q}"
   }
  ],
  "parse": {
   "kind": "derived"
  },
  "strategies": {
   "reasoning": {
    "visible": false,
    "routings": [
     {
      "from": "text",
      "pattern": "(?=Thought)(.*)",
      "to": "@role",
      "consume": true
     }
    ]
   }
  }
 },
 "signature": {
  "instructions": "Answer.",
  "fields": [
   {
    "name": "q",
    "direction": "input",
    "shape": {
     "type": "string"
    }
   },
   {
    "name": "reasoning",
    "direction": "output",
    "shape": {
     "type": "string"
    },
    "role": "reasoning"
   },
   {
    "name": "answer",
    "direction": "output",
    "shape": {
     "type": "string"
    }
   }
  ]
 },
 "expect": {
  "code": "entry-malformed",
  "fix": {
   "action": "edit-entry",
   "path": "strategies['reasoning'].routings[0]"
  },
  "at": "load"
 }
}
