{
 "name": "refuse-bind-put-setting-overlap",
 "kind": "refuse",
 "entry": {
  "name": "place_v1",
  "versions": {
   "kernel": "0.8.0",
   "vocab": {}
  },
  "template": [
   {
    "role": "system",
    "text": "{instruction}\n\nAnswer in exactly this form:\n{% for f in outputs %}<{f.name}>\n{f.value}\n</{f.name}>\n{% endfor %}"
   },
   {
    "role": "user",
    "text": "{q}"
   }
  ],
  "reader": {
   "kind": "derived"
  },
  "transports": {
   "tools": {
    "put": {
     "@purpose": "request.tools"
    },
    "request_settings": {
     "tools": [
      {
       "type": "function",
       "name": "fixed",
       "parameters": {
        "type": "object"
       }
      }
     ]
    }
   },
   "context": {
    "put": {
     "@purpose": "message:system"
    }
   }
  }
 },
 "signature": {
  "instructions": "Use tools.",
  "fields": [
   {
    "name": "q",
    "direction": "input",
    "shape": {
     "type": "string"
    }
   },
   {
    "name": "spec",
    "direction": "input",
    "shape": {
     "media": "function"
    },
    "purpose": "tools"
   },
   {
    "name": "ctx",
    "direction": "input",
    "shape": {
     "type": "string"
    },
    "purpose": "context"
   },
   {
    "name": "answer",
    "direction": "output",
    "shape": {
     "type": "string"
    }
   }
  ]
 },
 "expect": {
  "code": "setting-conflict",
  "fix": {
   "action": "edit-entry",
   "path": "transports['tools'].put"
  },
  "at": "bind"
 }
}
