{
 "name": "refuse-parse-close-ambiguous",
 "kind": "refuse",
 "entry": {
  "name": "derived_v1",
  "versions": {
   "kernel": "0.8.0",
   "vocab": {}
  },
  "template": [
   {
    "role": "system",
    "text": "{instruction}\n\nAnswer in exactly this form:\n{% for f in outputs %}<{f.name}>\n{f.value}\n</{f.name}>\n{% endfor %}"
   },
   {
    "role": "user",
    "text": "{q}"
   }
  ],
  "reader": {
   "kind": "derived"
  }
 },
 "signature": {
  "instructions": "Answer.",
  "fields": [
   {
    "name": "q",
    "direction": "input",
    "shape": {
     "type": "string"
    }
   },
   {
    "name": "answer",
    "direction": "output",
    "shape": {
     "type": "string"
    }
   },
   {
    "name": "score",
    "direction": "output",
    "shape": {
     "type": "integer"
    }
   }
  ]
 },
 "response": "<answer>\nA </answer> B\n</answer>\n<score>\n9\n</score>",
 "expect": {
  "code": "parse-ambiguous",
  "at": "parse"
 }
}
